{
  "execution_id": "exec_20260914_001",
  "status": "success",
  "execution_time_ms": 840,
  "metrics": {
    "green_coverage": 128000,
    "mean_green": 142.7,
    "std_green": 38.2,
    "max_green": 255.0,
    "method_used": "ExG",
    "threshold_used": 0.1
  },
  "artifacts": {
    "vegetation_mask": {
      "file_path": "/app_storage/runs/001/exec_20260914_001_vegetation_mask.png",
      "format": "image/png",
      "bounds": [116.8523, -1.246, 116.855, -1.2435]
    },
    "detection_overlay": {
      "file_path": "/app_storage/runs/001/exec_20260914_001_overlay.png",
      "format": "image/png",
      "bounds": [116.8523, -1.246, 116.855, -1.2435]
    }
  },
  "error": null
}
